{
  "$schema": "https://json-schema.org/draft/2020-12/schema",
  "$id": "urn:craftsky:service-status:2",
  "title": "CraftSky public app status schema 2",
  "description": "Independent public controls. Omit a section to disable it; unknown fields are ignored. Semantic validation additionally bounds bytes, URLs, calendar dates and version ranges.",
  "type": "object",
  "properties": {
    "schemaVersion": {
      "const": 2,
      "type": "integer"
    },
    "revision": {
      "$ref": "#/$defs/revision"
    },
    "maintenance": {
      "$ref": "#/$defs/maintenance"
    },
    "minimumVersions": {
      "type": "object",
      "properties": {
        "ios": {
          "$ref": "#/$defs/version"
        },
        "android": {
          "$ref": "#/$defs/version"
        },
        "web": {
          "$ref": "#/$defs/version"
        }
      },
      "required": []
    },
    "message": {
      "$ref": "#/$defs/message"
    }
  },
  "required": [
    "schemaVersion",
    "revision"
  ],
  "$defs": {
    "shortText": {
      "type": "string",
      "minLength": 1,
      "maxLength": 160,
      "pattern": "\\S"
    },
    "description": {
      "type": "string",
      "minLength": 1,
      "maxLength": 2400,
      "pattern": "\\S"
    },
    "revision": {
      "type": "string",
      "pattern": "^[A-Za-z0-9_-]{1,64}$(?![\\s\\S])"
    },
    "version": {
      "description": "Strict SemVer; core and numeric prerelease components have at most 15 digits. Build metadata does not affect precedence.",
      "type": "string",
      "pattern": "^(0|[1-9][0-9]{0,14})\\.(0|[1-9][0-9]{0,14})\\.(0|[1-9][0-9]{0,14})(?:-((?:0|[1-9][0-9]{0,14}|[0-9]*[A-Za-z-][0-9A-Za-z-]*)(?:\\.(?:0|[1-9][0-9]{0,14}|[0-9]*[A-Za-z-][0-9A-Za-z-]*))*))?(?:\\+[0-9A-Za-z-]+(?:\\.[0-9A-Za-z-]+)*)?$(?![\\s\\S])"
    },
    "httpsUrl": {
      "type": "string",
      "format": "uri",
      "pattern": "^[hH][tT][tT][pP][sS]://[^/@\\s]+(?:[/?#]|$)"
    },
    "cta": {
      "type": "object",
      "properties": {
        "text": {
          "$ref": "#/$defs/shortText"
        },
        "url": {
          "$ref": "#/$defs/httpsUrl"
        },
        "destination": {
          "enum": [
            "feed",
            "projects",
            "search",
            "notifications",
            "profile",
            "settings"
          ]
        }
      },
      "required": [
        "text"
      ],
      "oneOf": [
        {
          "required": [
            "url"
          ],
          "not": {
            "required": [
              "destination"
            ]
          }
        },
        {
          "required": [
            "destination"
          ],
          "not": {
            "required": [
              "url"
            ]
          }
        }
      ]
    },
    "maintenance": {
      "type": "object",
      "properties": {
        "title": {
          "$ref": "#/$defs/shortText"
        },
        "description": {
          "$ref": "#/$defs/description"
        },
        "estimatedRecoveryAt": {
          "type": "string",
          "format": "date-time",
          "pattern": "^\\d{4}-\\d{2}-\\d{2}T\\d{2}:\\d{2}:\\d{2}(?:\\.\\d{1,6})?(?:Z|[+-]\\d{2}:\\d{2})$(?![\\s\\S])"
        }
      },
      "required": [
        "title",
        "description"
      ]
    },
    "message": {
      "type": "object",
      "properties": {
        "title": {
          "$ref": "#/$defs/shortText"
        },
        "description": {
          "$ref": "#/$defs/description"
        },
        "revision": {
          "$ref": "#/$defs/revision"
        },
        "minVersion": {
          "$ref": "#/$defs/version"
        },
        "maxVersion": {
          "$ref": "#/$defs/version"
        },
        "imageUrl": {
          "$ref": "#/$defs/httpsUrl"
        },
        "cta": {
          "$ref": "#/$defs/cta"
        }
      },
      "required": [
        "title",
        "description",
        "revision",
        "minVersion"
      ]
    }
  }
}
